{"all_ready_exercised_and_released":true,"evidence_filename":"minimal-adapter-certification-sha256-94f1a67164d8404481acaf91ba373218a66264996bc36a2f8af282fdfef3d02f.json","evidence_sha256":"94f1a67164d8404481acaf91ba373218a66264996bc36a2f8af282fdfef3d02f","observed_at":"2026-08-13T17:56:28Z","protocol_revision_id":"rcid:v1:adapter-protocol-revision:h:jcs-sha256-v1:c9dd4b0a7e0c7fc6ae43586392e402b0036c03e9f2b1d5e0a43828d11945eda1","repository_state":{"head_commit":"9feca9426cbfe56b67b9cd9a69d73db666e59228","worktree_clean":false},"results":[{"adapter_release_manifest_id":"rcid:v1:adapter-release-manifest:h:jcs-sha256-v1:e0aa11e13c2a5097dbac81ec9fdf516ab476de431ca3005da2d339dbee61fd6a","adapter_source_digest":"4be09e59ea1b980c0580f28c4b5e79c83ab4a8d4fd0143ceb4398db44ed4e8a1","case_statuses":["completed","completed","unsupported"],"certified_case_count":3,"environment_fingerprint_id":"rcid:v1:environment-fingerprint:h:jcs-sha256-v1:9e6d9f0cb990d3e42808df731c7a94d60e9ea722611670737d400e9217371aec","environment_verification_digest":"893055896b2b98aa26a92d330bc93b0741e2e3038d845ba3dc9f9873a0a48578","handshake_transcript_sha256":"e1e0cb819d33a3ad23d7c56b6c4a876e2ea3e7315e3a1f3784b1e4be1694db0b","infrastructure_retry_count":0,"process_attempt_count":1,"process_attempts_sha256":"d053b5ccfeb57f3ef5e241f1e07b4d1f211feb442f7a988ca18d5f9029238ba9","process_execution_sha256":"5d8313e186a316677651a0da25027ab7bbe09242d3b4a337ea7060e16361bbed","provider_implementation_digest":"97966bf51705bb736caacbcbb04ec606ed85ba2fac9a227f5f4347a794bb8d4e","recipe_revision_id":"rcid:v1:environment-recipe-revision:h:jcs-sha256-v1:9f3f23e08025d83c2ae798b18f6f5306e8fb1d4fca6e14618913e62e546badc8","response_set_sha256":"d726f3f8c08e3871d84dda964c5c1f367e37ab7365e35b9a9d8ddc88990acf39","selection_key":"pcre2-ordinary","target_profile_id":"rcid:v1:profile:u7:019ff984-a52e-7cff-8789-6bbe35540702","target_release_id":"rcid:v1:release:u7:019ff984-a52e-737a-8353-17af9584dc6f"},{"adapter_release_manifest_id":"rcid:v1:adapter-release-manifest:h:jcs-sha256-v1:691d916e52088fc25ded9a666683bfa918d3a4bd41602e93311f8a1a1c6fe95a","adapter_source_digest":"8e49146d2665da734d992aad7fc7c7cb73b262a1fa2a61e136251fc964ee742e","case_statuses":["completed","completed","unsupported"],"certified_case_count":3,"environment_fingerprint_id":"rcid:v1:environment-fingerprint:h:jcs-sha256-v1:e4f9f102fbb2662a6f3d5808febbb59f8458cfc5612d1e9d7691bb853b33f732","environment_verification_digest":"ca9905d8402ae81cfa05d972513bc4f4a17d7c4e329e6a7738879d10b45ca2bc","handshake_transcript_sha256":"65f4891492d224048d8304ec6472fd5507ff29c37e857810860ca0bcbabc165b","infrastructure_retry_count":0,"process_attempt_count":1,"process_attempts_sha256":"a2d9c54afe32431ce5f739830c8606cea5ea945a497d60f1905e05b2019d9c74","process_execution_sha256":"82a9ca08d0243fd5a1914fd8e8f0acbd354f04390fbbae1ac57fc4e82dc56add","provider_implementation_digest":"97966bf51705bb736caacbcbb04ec606ed85ba2fac9a227f5f4347a794bb8d4e","recipe_revision_id":"rcid:v1:environment-recipe-revision:h:jcs-sha256-v1:5186355eb6137b5ec6692dff7b03df4afe45bf5d9a572f97572730585080b029","response_set_sha256":"46a77d52b8d7a755d09a8f68437b602362bc74b50fd4f99fb50f97fdf65c0386","selection_key":"python-re","target_profile_id":"rcid:v1:profile:u7:019ff984-a52e-746c-b7c9-7f82de44ebfd","target_release_id":"rcid:v1:release:u7:019ff984-a52e-755c-a7b5-29741bc00c2c"},{"adapter_release_manifest_id":"rcid:v1:adapter-release-manifest:h:jcs-sha256-v1:654c4bb9a59a8d6a40674e00ded4d88876d2ecc003be56c126829dc8a8d51128","adapter_source_digest":"c762b62806541418d1ea3208abd1752eff746d451bcf15b9d2bc4737688e2891","case_statuses":["completed","completed","unsupported"],"certified_case_count":3,"environment_fingerprint_id":"rcid:v1:environment-fingerprint:h:jcs-sha256-v1:59bfb1533506e02317f1ec1861bd97bf0cb3b272e7d5efb52d95cf85a5a2e5d7","environment_verification_digest":"7a979c2d9aaf97e01dec8545d078077d0c6c237ab681df75fd8d318040066ad2","handshake_transcript_sha256":"e5bed366cc73672a582e0aef784974787b0780ffac93572714112027b68b2c3b","infrastructure_retry_count":0,"process_attempt_count":1,"process_attempts_sha256":"bc63bdef1b7e2e975ad38eba24cfec5b405c3e3e9f3a0de24a88810224875553","process_execution_sha256":"3f73d4e45125f65bd2e89c94558fecbd795e0a6608c306fda66b3cb4dad91c5b","provider_implementation_digest":"97966bf51705bb736caacbcbb04ec606ed85ba2fac9a227f5f4347a794bb8d4e","recipe_revision_id":"rcid:v1:environment-recipe-revision:h:jcs-sha256-v1:daf19b0fd9c1c0d1febb1252037be2bf6a20e8b5f5958cc879cd8adfa7a1cb12","response_set_sha256":"6b1308bd09cb20b722303524a5aa9fb44a109320c28525faff1fdb52931b74b6","selection_key":"mysql-regex","target_profile_id":"rcid:v1:profile:u7:019ff984-a52e-711e-82d2-03b77a6192e7","target_release_id":"rcid:v1:release:u7:019ff984-a52e-7487-8f0d-5046164b1b61"}],"schema_version":"minimal-adapter-certification.v1","trust_class":"untrusted_public"}
